Event,Site,Date,Round,White,Black,Result,WhiteElo,BlackElo,ECO,Moves
Gijon,Gijon,1945.??.??,1,Clotas,"Alekhine, Alexander",0-1,,,C15,e2e4 e7e6 d2d4 d7d5 b1c3 f8b4 g1e2 d5e4 a2a3 b4c3 e2c3 b8c6 f1b5 g8e7 c1g5 f7f6 g5e3 e8g8 d1d2 f6f5 e1c1 a7a6 b5e2 e7d5 c3d5 e6d5 e3f4 b7b5 d2c3 d8d7 h2h4 a8b8 c3c5 f8f7 a3a4 c6d8 f4e5 b5a4 c2c4 c8b7 h1h3 d8e6 c5a5 b8c8 h3c3 f7f8 f2f3 e6d8 c4d5 b7d5 e2a6 d5b7 a6c4 g8h8 d4d5 d8f7 e5d4 f7d6 c4e2 f5f4 f3e4 d6e4 c3c4 a4a3 b2a3 c7c5 d5c6 c8c6 c4c6 d7c6 c1b2 f8c8 e2d3 e4f6 d1d2 c6c1 b2b3 b7d5 b3a4 d5c6 a4b3 c8b8 d3b5 f6d7
Gijon,Gijon,1945.??.??,2,"Alekhine, Alexander","Bonet, Ariel",1-0,,,C84,e2e4 e7e5 g1f3 b8c6 f1b5 a7a6 b5a4 g8f6 b1c3 b7b5 a4b3 f8e7 e1g1 d7d6 c3d5 c8e6 c2c3 c6a5 d5e7 d8e7 b3c2 c7c5 d2d4 e7c7 c1g5 f6d7 f3e5 d7e5 d4e5 d6e5 d1h5 e8g8 b2b3 f7f6 g5e3 c5c4 b3b4 a5b7 f2f4 c7f7 h5e2 e5f4 f1f4 f7e7 a1f1 f8f7 e3d4 a8f8 e2h5 e7d7 a2a4 b5a4 f1a1 a4a3 e4e5 f6f5 a1a3 d7c6 a3a1 e6c8 g2g4 g7g6 h5h6 b7d8 g4f5 c8f5 c2a4 c6b7 d4c5 d8e6 c5f8 e6f4 h6f4 f5h3 f4g3 f7f3 g3h3 f3h3 f8c5 b7e4 a4d7 h3c3 d7e6 g8g7 a1f1 g7h6 c5f2 e4e5 e6c8 e5g5 g1h1 c3c1 f1c1 g5c1 h1g2 c1b2 g2f3 b2b4 f2e3 h6g7 c8a6 c4c3 a6d3 b4d6 f3e4 d6c6 e4d4 c3c2 e3c1 c6h1
Gijon,Gijon,1945.??.??,3,"Lupi, Francesco","Alekhine, Alexander",0-1,,,D32,g1f3 d7d5 d2d4 c7c5 e2e3 g8f6 c2c4 e7e6 b1c3 f8e7 a2a3 e8g8 c4d5 e6d5 d4c5 e7c5 f1e2 b8c6 e1g1 c8e6 b2b4 c5b6 c1b2 d8e7 c3a4 b6c7 a4c5 f6e4 c5b7 c7b6 b7c5 e4c5 b4c5 b6c5 d1d2 f7f6 f1c1 a8b8 d2c3 c5d6 c1c2 b8b6 f3d4 c6d4 e3d4 e6f5 e2d3 f8c8 c3c8 f5c8 c2c8 g8f7 b2c3 e7d7 c8a8 b6b3 a1c1 d6a3
Gijon,Gijon,1945.??.??,4,"Alekhine, Alexander","Rico, A.",1/2-1/2,,,B11,e2e4 c7c6 b1c3 d7d5 g1f3 c8g4 h2h3 g4f3 d1f3 e7e6 d2d4 g8f6 c1g5 f8e7 e1c1 f6e4 g5e7 d8e7 c3e4 d5e4 f3e4 b8d7 f1d3 d7f6 e4e5 e8c8 d3c4 e7c7 e5g5 f6e4 g5e3 e4d6 c4d3 c7a5 c1b1 d6f5 d3f5 a5f5 d1d3 d8d5 h1d1 h8d8 a2a3 h7h5 b1a1 f5g5 f2f4 g5e7 g2g4 h5g4 h3g4 e7d7 c2c4 d5d6 d4d5 e6d5 e3a7 d7c7 c4d5 d6d5 a7a8 c7b8 d3d5 d8d5 a8b8 c8b8 d1d5 c6d5 a1a2 b8c7 a2b3 c7d6 b3c3 g7g5 f4g5 d6e5 c3d3 e5f4 a3a4 f4g5 a4a5 f7f5 g4f5 g5f5 b2b4 f5e5 b4b5 e5d6 d3d4 d6c7 d4d5 c7d7 d5e5 d7c7 e5e6 c7c8 e6d6 c8d8 d6d5 d8d7 d5e5 d7c7 e5e6 c7c8 e6d6 c8d8 b5b6 d8c8 d6e7 c8b8 e7d7 b8a8 a5a6 a8b8 a6a7 b8a8
Gijon,Gijon,1945.??.??,5,"Mampel, M.","Alekhine, Alexander",0-1,,,C64,e2e4 e7e5 g1f3 b8c6 f1b5 f8c5 c2c3 d8f6 e1g1 g8e7 d2d3 h7h6 c1e3 c5b6 d3d4 e8g8 d4d5 c6d8 b5e2 d7d6 b1d2 e7g6 d2c4 b6e3 f2e3 f6e7 c4d2 f7f5 e4f5 c8f5 d1e1 c7c6 c3c4 d8f7 e1g3 a8c8 a1c1 f7h8 h2h4 e7c7 h4h5 g6e7 e3e4 f5d7 b2b3 f8f4 a2a4 c7a5 g3e1 h8f7 f3h2 a5c5 g1h1 c6d5 f1f4 e5f4 e4d5 e7d5 e2f3 d5e3 f3b7 c8e8 e1f2 f7e5 b7e4 e8f8 c1e1 d7c6 e4c6 c5c6 f2e2 f8f5 d2f1 e3g2 e2g2 f4f3 h2f3 e5f3 f1g3 f5f4 e1e4 f4e4
Gijon,Gijon,1945.??.??,6,"Alekhine, Alexander","Gallego, L.",1-0,,,C84,e2e4 e7e5 g1f3 b8c6 f1b5 a7a6 b5a4 g8f6 e1g1 b7b5 a4b3 f8e7 d2d4 d7d6 c2c3 c8g4 c1e3 c6a5 d4e5 g4f3 d1f3 d6e5 b3c2 e8g8 b1d2 c7c5 f1d1 d8c7 d2f1 a5c4 e3c1 f8d8 d1e1 c4b6 f1g3 g7g6 c1h6 g8h8 b2b3 c7c6 g3f1 e7f8 h6g5 f8e7 f1e3 c6e6 c3c4 b5c4 b3c4 h8g7 e3d5 d8d7 a1b1 b6c4 c2b3 c4a5 d5c7 e6c6 c7a8 a5b3 f3b3 c6a8 f2f3 h7h6 g5e3 f6e8 b3b8 a8b8 b1b8 e8c7 b8b7 f7f5 e4f5 g6f5 e3f2
Gijon,Gijon,1945.??.??,7,"Fernandez Rua, J.","Alekhine, Alexander",0-1,,,B25,e2e4 c7c5 b1c3 b8c6 g2g3 g7g6 f1g2 f8g7 g1e2 d7d6 d2d3 c8d7 e1g1 d8c8 c1e3 g8f6 d1d2 f6g4 c3d1 h7h5 h2h4 g4e3 d2e3 c6e5 f2f3 g7h6 f3f4 e5g4 e3f3 f7f5 d1c3 h6g7 c3d1 e8g8 c2c3 c5c4 d3d4 d7c6 d4d5 c6d7 d1f2 c8c5 g1h1 g4e3 f1g1 c5b6 a1b1 f5e4 f2e4 d7f5 b2b3 f5g4 f3f2 e3g2 h1g2 b6a5 b3c4 a5a2 g1e1 a2c4 e2d4 c4d5 b1b5 g7d4 b5d5 d4f2 e4f2 g4d7 d5g5 g8f7
Gijon,Gijon,1945.??.??,8,"Alekhine, Alexander","De las Clotas, M.",1-0,,,C36,e2e4 e7e5 f2f4 e5f4 g1f3 d7d5 e4d5 g7g5 f1c4 f8g7 d2d4 h7h6 b1c3 g8e7 e1g1 c8f5 f3e5 b8d7 d5d6 e7c6 e5f7 d8f6 d1e2 e8f8 d6c7 c6d4 e2f2 d7e5 f7e5 f6e5 c3d5 b7b5 d5f4 g5f4 c1f4 e5f6 c4d5 a8e8 a1e1 e8e7 f4d6
Gijon,Gijon,1945.??.??,9,"Medina Garcia, Antonio Angel","Alekhine, Alexander",1-0,,,B75,e2e4 c7c5 g1f3 d7d6 d2d4 c5d4 f3d4 g8f6 b1c3 g7g6 c1e3 f8g7 f2f3 a7a6 d1d2 b8c6 d4b3 h7h6 a2a4 c6a5 a1a3 c8d7 f1e2 a8c8 e1g1 a5c4 e2c4 c8c4 a4a5 d8c8 b3d4 e8g8 d4e2 g8h8 f1c1 d7e6 c3a4 f6d7 b2b3 c4c7 c2c4 f7f5 e2f4 e6g8 f4d5 f5e4 d5c7 c8c7 f3e4 d7c5 a4c5 d6c5 a3a2 g7e5 e3h6 e5h2 g1h1 h2f4 h6f4 f8f4 g2g3 f4g4 d2c3 e7e5 a2h2 h8g7 c3f3 g8e6 c1f1 c7e7 h1g2 e7d8 f3e3 g4g5 f1h1 e6g8 h1f1 g8e6 f1f2 d8e7 h2h1 g7g8 f2d2 g8g7 e3d3 e7f8 d2f2 f8e7 h1d1 g5g4 d3d8 e7d8 d1d8 g4e4 d8b8 g7h6 b8b7 h6g5 f2b2 e6f5 b7c7 e4e3 g2f2 e3c3 c7c5 e5e4 b2e2 c3f3 f2e1 f3g3 e2e4 g3b3 e1f2 b3d3 f2e2 d3a3 e4d4 a3a2 e2e3 a2a3 e3d2 g5h5 d4d6 h5g5 d6a6 a3d3 d2e2 d3d7 a6b6 g5f4 c5d5 d7e7 e2d2 f5e4 b6f6 f4g4 d5d4 g4g5 f6f1 e4b7 d4d6 g5h5 a5a6 b7a8 f1g1 g6g5 d6d8 e7a7 d8g8 a7a6 g8g5 h5h6 g5g3 a6a2 d2c3 a2h2 g3g6 h6h7 g6g7 h7h6 g1g6 h6h5 g7h7 h5g6 h7h2 g6f6 h2e2
