Event,Site,Date,Round,White,Black,Result,WhiteElo,BlackElo,ECO,Moves
London m1,London,1876.??.??,?,"Steinitz, William","Blackburne, Joseph Henry",1-0,,,C39,e2e4 e7e5 f2f4 e5f4 g1f3 g7g5 h2h4 g5g4 f3e5 g8f6 f1c4 d7d5 e4d5 f8g7 d2d4 e8g8 c1f4 f6d5 c4d5 d8d5 e1g1 c7c5 b1c3 d5d4 d1d4 c5d4 c3d5 b8c6 e5c6 b7c6 d5e7 g8h8 e7c6 c8b7 c6e5 a8c8 f1f2 b7e4 a1d1 f7f5 e5d3 f8e8 f2e2 h8g8 d3e1 g8f7 f4g3 e8e6 g3f2 e4c2 e2e6 c2d1 e6d6 f7e7 d6a6 c8c7 g1f1 c7d7 a6a3 e7e6 e1d3 g7f8 a3a5 d1c2 f1e2 e6f6 a5a6 f6g7 a6a7 d7a7 f2d4 g7f7 d4a7 f8d6 a7e3 f7e6 e2d2 c2d3 d2d3 e6d5 a2a4 f5f4 e3f2 g4g3 f2g1 d6b4 d3e2 b4a5 e2f3 d5c4 f3f4 a5c7 f4g5 c7d8 g5g4 d8c7 g1e3 c7e5 a4a5 c4b5 b2b4 e5d6 e3c5 d6e5 g4f5 e5c3 h4h5 b5a6 f5e6
London m1,London,1876.??.??,?,"Steinitz, William","Blackburne, Joseph Henry",1-0,,,C77,e2e4 e7e5 g1f3 b8c6 f1b5 a7a6 b5a4 g8f6 d2d3 d7d6 c2c3 f8e7 h2h3 e8g8 d1e2 f6e8 g2g4 b7b5 a4c2 c8b7 b1d2 d8d7 d2f1 c6d8 f1e3 d8e6 e3f5 g7g6 f5e7 d7e7 c1e3 e8g7 e1c1 c7c5 d3d4 e5d4 c3d4 c5c4 d4d5 e6c7 e2d2 a6a5 e3d4 f7f6 d2h6 b5b4 g4g5 f6f5 d4f6 e7f7 e4f5 g6f5 g5g6 f7g6 f6g7 g6h6 g7h6 f8f6 h1g1 f6g6 c2f5 g8f7 f5g6 h7g6 f3g5 f7g8 g1e1
London m2,London,1876.??.??,?,"Blackburne, Joseph Henry","Zukertort, Johannes Hermann",0-1,,,C45,e2e4 e7e5 g1f3 b8c6 d2d4 e5d4 f3d4 g8f6 d4c6 b7c6 f1d3 d7d5 d1e2 f8e7 b1c3 e8g8 e1g1 f8e8 e4e5 c8g4 e2d2 f6d7 f2f4 d7c5 f4f5 c5d3 c2d3 g7g6 f5f6 e7f8 d2g5 d8d7 f1f4 g4f5 d3d4 c6c5 f4h4 f5d3 g5g3 c5d4 h4d4 d3c4 d4h4 d7f5 c1f4 d5d4 c3a4 c4b5 b2b3 b5a4 b3a4 a8b8 a1e1 b8b1 f4c1 f8b4 e1f1 f5f1 g1f1 b1c1 f1e2 e8e5 g3e5 c1e1 e2d3 e1e5 h4d4 b4d6
London m2,London,1876.??.??,?,"Zukertort, Johannes Hermann","Blackburne, Joseph Henry",0-1,,,C29,e2e4 e7e5 b1c3 g8f6 f2f4 d7d5 d2d3 d5d4 f4e5 d4c3 e5f6 d8f6 b2c3 f6c3 c1d2 c3f6 g1f3 b8c6 f1e2 f8c5 c2c3 c8g4 d3d4 g4f3 e2f3 c6d4 c3d4 f6d4 h1f1 e8c8 a1b1 f7f5 d1c2 h8e8 c2b2 e8e4 f3e4 d4e4 e1d1 c5e3 f1e1 e4a4
London m2,London,1876.??.??,?,"Zukertort, Johannes Hermann","Blackburne, Joseph Henry",0-1,,,C01,e2e4 e7e6 d2d4 d7d5 e4d5 e6d5 g1f3 g8f6 f1d3 f8d6 e1g1 e8g8 b1c3 b8c6 c3b5 d6e7 c1f4 a7a6 b5c7 a8a7 f4e5 b7b5 c7b5 a6b5 d3b5 d8b6 a2a4 f6e4 c2c3 c8g4 e5f4 e7d6 f4d6 e4d6 b5c6 g4f3 d1f3 b6c6 b2b3 d6e4 f1c1 a7b7 b3b4 c6c4 f3e3 f8e8 f2f3 e4f6 e3f4 b7e7 b4b5 e7e6 h2h4 f6h5 f4g5 g7g6 a1b1 f7f6 g5g4 f6f5 g4g5 g8g7 b1b4 e6e1
London m1,London,1876.??.??,?,"Steinitz, William","Blackburne, Joseph Henry",1-0,,,C29,e2e4 e7e5 b1c3 g8f6 f2f4 d7d5 d2d3 f8b4 f4e5 f6e4 d3e4 d8h4 e1e2 b4c3 b2c3 c8g4 g1f3 d5e4 d1d4 g4h5 e2e3 h5f3 f1b5 c7c6 g2f3 c6b5 d4e4 h4h6 e3f2 h6c6 e4d4 b8a6 c1a3 b5b4 a3b4 a6b4 d4b4 a8c8 a1b1 b7b6 b1b3 c8d8 h1e1 d8d5 e1e4 c6h6 h2h4 g7g5 e5e6 f7e6 b4a4 e8e7 a4a7 d5d7 a7b6 h8c8 b6e3 e7f7 b3b5 c8d8 b5g5 d7d2 f2g3 d2d6 e4f4 f7e7 e3e5 d6d5 g5g7 e7e8 e5f6 h6f6 f4f6 d8d6 g7h7 d5c5 f6g6 e8f8 h4h5 d6d5 g6e6 d5h5 h7h5 c5h5 a2a4 h5c5 e6e3 c5c4 g3f2 f8f7 f2e2 f7f6 e2d3 c4a4 c3c4 a4a1 c4c5 a1a4 e3e4 a4a1 d3c4 a1a4 c4d5 a4a3 c5c6
London m1,London,1876.??.??,2,"Blackburne, Joseph Henry","Steinitz, William",0-1,,,C45,e2e4 e7e5 g1f3 b8c6 d2d4 e5d4 f3d4 d8h4 d4b5 f8b4 c1d2 h4e4 f1e2 e8d8 e1g1 b4d2 d1d2 g8f6 b1c3 e4e5 f1e1 a7a6 b5a3 e5d4 d2g5 h8g8 a1d1 h7h6 g5g3 d4e5 g3h4 e5g5 h4c4 c6e5 c4b4 e5c6 b4b3 g8f8 a3c4 b7b5 e2f3 c8b7 c3d5 a8b8 b3a3 f8g8 c4e5 c6e5 a3e7 d8c8 e1e5 f6d5 e7f7 g5d8 f3d5 b7d5 e5d5 d7d6 d5d3 d8e8 f7d5 g8f8 d5d4 f8f6 d3e3 e8c6 d1e1 c8b7 e3c3 c6d7 c3e3 b8f8 f2f3 f8f7 e3e8 d7c6 c2c3 f6f5 e8e7 f5d5 d4h4 c6c5 g1f1 g7g5 h4e4 f7e7 e4e7 d5d2 e1e2 d2d1 e2e1 c5c4 e7e2 d1e1 f1e1 c4a2 e2e4 d6d5 e4c2 a2c4 c2d2 a6a5 g2g3 b5b4 f3f4 g5f4 g3f4 b4c3 b2c3 a5a4 e1d1 a4a3 d1c1 b7c6 c1b1 c4b3 b1a1 c6d6 d2c1 d6e7 c1d2 e7f7 d2c1 c7c5 c1d2 f7f6 d2c1 f6f5 c1d2 b3b2 d2b2 a3b2 a1b2 f5f4
London m1,London,1876.??.??,4,"Blackburne, Joseph Henry","Steinitz, William",0-1,,,C45,e2e4 e7e5 g1f3 b8c6 d2d4 e5d4 f3d4 d8h4 d4b5 f8b4 c1d2 h4e4 f1e2 e8d8 e1g1 b4d2 d1d2 a7a6 b1c3 e4e5 b5a3 b7b5 e2f3 g8e7 a1d1 e5f5 f1e1 a8b8 d2e2 d7d6 c3e4 c8d7 e2e3 f7f6 g2g4 f5g6 e4d6 c7d6 d1d6 d8c7 f3c6 e7c6 e3g3 c7c8 e1d1 b8b7 g3g2 c6b8 d1d4 h7h5 g2d5 g6g5 d5g5 f6g5 d6g6 d7g4 g6g5 h8e8 g1g2 b7f7 h2h3 g4d7 g2g3 e8e2 g5h5 e2f2 h5c5 b8c6 d4d3 c8c7 a3b1 c7b6 c5d5 c6b8 b1d2 d7c6 d2e4 f2e2 e4c3 e2c2 d3d2 c2c3 b2c3 c6d5 d2d5 f7c7 d5d3 b8c6 g3f4 c7f7 f4e4 f7f2 a2a3 f2a2 c3c4 b5c4 d3g3 a2d2 g3g7 d2d4 e4f5 c4c3
London m1,London,1876.??.??,6,"Blackburne, Joseph Henry","Steinitz, William",0-1,,,C45,e2e4 e7e5 g1f3 b8c6 d2d4 e5d4 f3d4 d8h4 d4b5 f8b4 c1d2 h4e4 f1e2 e8d8 e1g1 b4d2 d1d2 a7a6 b5a3 e4d4 d2g5 d4f6 g5d2 f6b2 a3c4 b2d4 d2c1 g8e7 b1d2 d7d6 f1d1 c8e6 c1a3 e7d5 d2b3 d4c3 e2f1 d5b4 c4e3 h8e8 d1d2 e6b3 a1d1 e8e3 f2e3 b4c2 a3c1 c3e3 g1h1 b3a4 f1c4 c2d4 d1e1 e3f4 e1f1 f4h6 c1b2 h6e3 c4f7 a4b5 f1d1 d4f5 a2a4 c6e5 a4b5 e5f7 d2e2 e3h6 b2b3 a6b5 g2g4 f5d4 d1d4 a8a1 h1g2 h6f6 d4e4 f7e5 e2f2 f6g6 e4f4 c7c6 b3e3 d8c7 h2h3 h7h5 f4f5 h5g4 f5g5 g4h3 g2h2 a1a3 e3e5 d6e5 g5g6 b5b4 f2b2 c6c5 b2f2 a3d3 f2c2 b7b6 g6e6 b4b3 c2b2 c5c4 e6e5 c7c6 e5g5 d3d5 g5g7 c6c5 h2h3 c5b4 b2b1 b6b5 g7g4 d5d2 g4g5 b3b2 h3g3 c4c3 g3f3 b4c4 g5g1 c4b3 f3e3 d2d8 g1f1 c3c2 e3e2 b3a2
